{
  "application": "demo-api",
  "environment": "aws-dev",
  "expiresAt": "2026-08-18T07:51:56Z",
  "identity": {
    "buildWorkflowRunId": "31950329805",
    "imageDigest": "sha256:45744978f664522cc3c952eba6e358aba261640338fa6d39820f165c18dbc5b0",
    "imageRepository": "ghcr.io/sterlingaureum/startup-devops-baseline/demo-api",
    "imageTag": "sha-e43b535",
    "sourceCommit": "e43b535a1dd802c221a24c0bfde3c471c6a5df5f",
    "sourceRepository": "SterlingAureum/startup-devops-baseline"
  },
  "orchestration": {
    "actor": "SterlingAureum",
    "ref": "refs/heads/main",
    "repository": "SterlingAureum/startup-devops-baseline",
    "revision": "7ddaab1b6da5249b43cbfdaf3b817e02cdee221f",
    "workflow": ".github/workflows/demo-api-release-orchestrator.yaml",
    "workflowRunAttempt": "1",
    "workflowRunId": "32007576475"
  },
  "qualificationScope": {
    "algorithm": "sha256-path-content-v1",
    "contract": "delivery/contracts/demo-api-qualification-scope.json",
    "contractSha256": "1dacdc45a83a6d243ec2a0ce32b54c43d37f7e2db5e2f9cda3ba84bd589b6f20",
    "files": [
      {
        "path": "apps/demo-api/helm/.helmignore",
        "sha256": "a8cde439d17550a6dfec399b0d7eef1a91c5942415fe9b168ce60b04d2847cd9"
      },
      {
        "path": "apps/demo-api/helm/Chart.yaml",
        "sha256": "fd0bd1f24dc504de303c9d56041bf9bc7b8b36c2351d57e0e5273b5e33746f6b"
      },
      {
        "path": "apps/demo-api/helm/templates/.gitkeep",
        "sha256": "e3b0c44298fc1c149afbf4c8996fb92427ae41e4649b934ca495991b7852b855"
      },
      {
        "path": "apps/demo-api/helm/templates/NOTES.txt",
        "sha256": "1a57bb3e1ca8dc53d2ce7a45a110020fc61046599dd5559f3415e8183488f7bc"
      },
      {
        "path": "apps/demo-api/helm/templates/_helpers.tpl",
        "sha256": "00117fa2ff08f0cf01c0f16f133a4ffd77956833777f81135d4cedb2a058616a"
      },
      {
        "path": "apps/demo-api/helm/templates/analysis-template.yaml",
        "sha256": "2555b0a9f058c3be8863602320e58ff240a82fac6a89ed893967d300580fb306"
      },
      {
        "path": "apps/demo-api/helm/templates/deployment.yaml",
        "sha256": "090b19b53e976cea884cbb199eb6eb165934ed4eca52b306788591bb97bd4e8c"
      },
      {
        "path": "apps/demo-api/helm/templates/ingress.yaml",
        "sha256": "f2cdfcb8b7e3e46d721fb3e283838d4d119d22d14303ed3c2c988fecd2ac8b06"
      },
      {
        "path": "apps/demo-api/helm/templates/rollout.yaml",
        "sha256": "26796700f863a28e8386de25f2ba22131c24de4c1eed2a988875d6a1e6535056"
      },
      {
        "path": "apps/demo-api/helm/templates/service.yaml",
        "sha256": "df5c3435e4cf5513e263c8f7fed8b5ad604da9a22651f4b3185950b20fa0544e"
      },
      {
        "path": "apps/demo-api/helm/templates/serviceaccount.yaml",
        "sha256": "330c92d48727bcb98658ad50989897622d6ea375a060818a13d221a1e713cefc"
      },
      {
        "path": "apps/demo-api/helm/values.yaml",
        "sha256": "5c5c5819575ab2a5d661d8b8dfadb86d2861bdfee53bca1132fb037ebdff2d38"
      },
      {
        "path": "apps/demo-api/helm/values/environments/aws-dev.yaml",
        "sha256": "e41d8d709d99c15c2602333bb6608d5f5c27c052a53764abe9c515c8db1caeba"
      },
      {
        "path": "apps/demo-api/helm/values/releases/aws-dev.yaml",
        "sha256": "2817d5d1a0f728a4e88e289ca46f5259a511339924daf303fe285316ccaffa22"
      },
      {
        "path": "clusters/aws/base/kustomization.yaml",
        "sha256": "90f89f79733314e627066e7369d93ae080d4edd5806ad105517be9cad1e4993b"
      },
      {
        "path": "clusters/aws/base/platform/demo-api.yaml",
        "sha256": "39dde604f28efdd85782373517343ea3184ca75df2db4bd2c96c6f04b70824dc"
      },
      {
        "path": "clusters/aws/base/platform/external-secrets-startup-apps.yaml",
        "sha256": "7cced6cf1225bf56df253863e304ee601fee8b83f7222357786df6a2e0abee41"
      },
      {
        "path": "clusters/aws/base/platform/kustomization.yaml",
        "sha256": "4a87b769eb332ff04cbe9feeabe583d31674a9aaf0f45b1a0f805376a109e2fb"
      },
      {
        "path": "clusters/aws/base/platform/runtime-qualification-rbac/application.yaml",
        "sha256": "cb0b3c9b9f2578aa9aa69a0a22c52f85204bb5028423b687e8d9809b7a4865d4"
      },
      {
        "path": "clusters/aws/base/platform/runtime-qualification-rbac/kustomization.yaml",
        "sha256": "a4d79b5adefa00ab9474b3f57c7c92abd958e5ae4eff935da6cd851905d6a909"
      },
      {
        "path": "clusters/aws/base/platform/startup-apps-network-policy.yaml",
        "sha256": "dc8ea5c479b0edc6e8f0671012fdc8e5dbef48a21c2a18fc39306ff350749b42"
      },
      {
        "path": "clusters/aws/base/security/external-secrets/startup-apps/demo-api-postgresql.yaml",
        "sha256": "b10aa34f356b0ef1e4cd2da26dd90e01b5108aec8e3e64d334ef18395c09a1a0"
      },
      {
        "path": "clusters/aws/base/security/external-secrets/startup-apps/kustomization.yaml",
        "sha256": "4483c1eb85bfe25bbabd4fc8d1ef545a8b56c60fdbcabf646876b1b28db2f1b4"
      },
      {
        "path": "clusters/aws/base/security/external-secrets/startup-apps/secret-store.yaml",
        "sha256": "40790daf99de314df0d1495f5f8d7520d30a2ae31c42dfabce8351d84264ceb2"
      },
      {
        "path": "clusters/aws/base/security/network-policies/startup-apps/kustomization.yaml",
        "sha256": "42f4be29988839231e0fc1f0ba72db8ad31ba9dde9123e24465b02333567762f"
      },
      {
        "path": "clusters/aws/base/security/network-policies/startup-apps/policies.yaml",
        "sha256": "bdad2268c2f8e4fb072e99bf4ca5ebfe3bbf0ba22bf48704a3dbb04d737b07e1"
      },
      {
        "path": "clusters/aws/base/security/runtime-qualification/kustomization.yaml",
        "sha256": "9d94b7d73aa521d50c03f08ae0b7ae5d28082ba7c66bde735505dcb52d1b4796"
      },
      {
        "path": "clusters/aws/base/security/runtime-qualification/rbac.yaml",
        "sha256": "65175526c399163af8638eb0cb785bbc854fc637df05e4817a4bca509fd1d72b"
      },
      {
        "path": "clusters/aws/overlays/dev/data-platform/postgresql/kustomization.yaml",
        "sha256": "4bbc5823009069f3a6842bbb2289d742af85efcc062fbb033411817255e1565b"
      },
      {
        "path": "clusters/aws/overlays/dev/kustomization.yaml",
        "sha256": "8149bfbaad2ec01d1610bc26e7e7753226936fdae3a7513b85a954a56390ce1f"
      },
      {
        "path": "clusters/aws/overlays/dev/root-app.yaml",
        "sha256": "6f0fc680b04b7df3194549e626764a758856ebfb7cf38e806f573c4b0297e11f"
      },
      {
        "path": "clusters/aws/overlays/dev/security/external-secrets/startup-apps/kustomization.yaml",
        "sha256": "0f6e3c4895757c17e5b4acdb72ed51984d529693f7e2999380de990f7f2226ba"
      },
      {
        "path": "clusters/aws/overlays/dev/security/network-policies/data-platform/kustomization.yaml",
        "sha256": "34ed08a7ec75406fdfbf2c5aa217bc27f2ad73f6161f03e45b5a1f1c7acb82b1"
      },
      {
        "path": "clusters/aws/overlays/dev/security/network-policies/startup-apps/kustomization.yaml",
        "sha256": "f3e9cce29e27b20e8b212229cc6d2f786aab8d714fe8fcb6da44270863fcfbf1"
      }
    ],
    "scopeSha256": "62805b7e0b4ba0e4d145e413eff7d3505cd05ce4dbe7f0d9c163a27a5ccbe166"
  },
  "recordedAt": "2026-08-17T07:52:18Z",
  "release": {
    "path": "apps/demo-api/helm/values/releases/aws-dev.yaml",
    "sha256": "2817d5d1a0f728a4e88e289ca46f5259a511339924daf303fe285316ccaffa22"
  },
  "releaseId": "demo-api-e43b535a1dd8-45744978f664",
  "runtimeQualification": {
    "result": {
      "application": "demo-api",
      "controlPlane": {
        "ref": "refs/heads/main",
        "releaseFile": "apps/demo-api/helm/values/releases/aws-dev.yaml",
        "releaseFileSha256": "2817d5d1a0f728a4e88e289ca46f5259a511339924daf303fe285316ccaffa22",
        "repository": "SterlingAureum/startup-devops-baseline",
        "revision": "7ddaab1b6da5249b43cbfdaf3b817e02cdee221f"
      },
      "environment": "aws-dev",
      "executor": {
        "awsCallerArn": "arn:aws:sts::542478884409:assumed-role/startup-devops-baseline-dev-github-runtime-read-role/runtime-32007576475-1",
        "clusterName": "startup-devops-baseline-dev",
        "githubEnvironment": "aws-dev-runtime",
        "kind": "ephemeral-self-hosted",
        "runnerName": "aureum",
        "workflowRunAttempt": "1",
        "workflowRunId": "32007576475"
      },
      "expected": {
        "imageDigest": "sha256:45744978f664522cc3c952eba6e358aba261640338fa6d39820f165c18dbc5b0",
        "imageReference": "ghcr.io/sterlingaureum/startup-devops-baseline/demo-api@sha256:45744978f664522cc3c952eba6e358aba261640338fa6d39820f165c18dbc5b0",
        "sourceCommit": "e43b535a1dd802c221a24c0bfde3c471c6a5df5f"
      },
      "expiresAt": "2026-08-18T07:51:56Z",
      "reason": "all_checks_passed",
      "recordedAt": "2026-08-17T07:51:56Z",
      "releaseId": "demo-api-e43b535a1dd8-45744978f664",
      "runtime": {
        "analysisRunName": "",
        "analysisRunPhase": "not-applicable",
        "argoApplication": "demo-api-aws-dev",
        "argoRevision": "7ddaab1b6da5249b43cbfdaf3b817e02cdee221f",
        "checks": [
          "argocd-synced-healthy",
          "release-annotations-match",
          "all-pods-ready",
          "immutable-pod-image-id-match",
          "https-health",
          "https-ready-database",
          "https-version-identity",
          "read-only-rbac-boundary"
        ],
        "httpsHostname": "demo.dev.aureumstack.com",
        "observedImageIds": [
          "ghcr.io/sterlingaureum/startup-devops-baseline/demo-api@sha256:45744978f664522cc3c952eba6e358aba261640338fa6d39820f165c18dbc5b0"
        ],
        "readyPodCount": 2,
        "rolloutPhase": "not-applicable",
        "workloadKind": "Deployment",
        "workloadName": "demo-api"
      },
      "schemaVersion": "v0.10.3",
      "status": "qualified"
    },
    "sha256": "559877d31de385919dc3d74937e2b99288e9377e8543b31afa31da8c7e5f6b15"
  },
  "schemaVersion": "v0.10.5",
  "staticQualification": {